<?xml version="1.0"?>
<!-- edited with XMLSPY v5 rel. 2 U (http://www.xmlspy.com) by nobody (nowhere) -->
<!DOCTYPE contents_page SYSTEM "dtd/dats.dtd" [
	<!ENTITY Daphne SYSTEM "Daphne/Daphne.ent.xml">
	<!ENTITY FinalBurnAlpha SYSTEM "FinalBurnAlpha/FinalBurnAlpha.ent.xml">
	<!ENTITY MAMEBeta SYSTEM "MAMEBeta/MAMEBeta.ent.xml">
	<!ENTITY MAMEChanges SYSTEM "MAMEChanges/MAMEChanges.ent.xml">
	<!ENTITY Nebula SYSTEM "Nebula/Nebula.ent.xml">
	<!ENTITY NebulaModel2 SYSTEM "NebulaModel2/NebulaModel2.ent.xml">
	<!ENTITY RAINE SYSTEM "RAINE/RAINE.ent.xml">
	<!ENTITY Tickle SYSTEM "Tickle/Tickle.ent.xml">
	<!ENTITY WinKawaks SYSTEM "WinKawaks/WinKawaks.ent.xml">
	<!ENTITY OlderEmus SYSTEM "OlderEmus/OlderEmus.ent.xml">
	<!ENTITY CPS1 SYSTEM "CPS-1/CPS-1.ent.xml">
	<!ENTITY CPS2 SYSTEM "CPS-2/CPS-2.ent.xml">
	<!ENTITY NeoGeo SYSTEM "Neo-Geo/Neo-Geo.ent.xml">
	<!ENTITY ZN SYSTEM "ZN/ZN.ent.xml">
	<!ENTITY M1 SYSTEM "M1/M1.ent.xml">
	<!ENTITY NebulaJukebox SYSTEM "NebulaJukebox/NebulaJukebox.ent.xml">
	<!ENTITY NeoJukeBox SYSTEM "NeoJukeBox/NeoJukeBox.ent.xml">
	<!ENTITY QPlayer SYSTEM "QPlayer/QPlayer.ent.xml">
	<!ENTITY MAMEArtwork SYSTEM "MAMEArtwork/MAMEArtwork.ent.xml">
	<!ENTITY MAMESamples SYSTEM "MAMESamples/MAMESamples.ent.xml">
]>
<contents_page>
	<section>
		<img src="RecentEmus.gif" width="158" height="40"/>
		<type>Emulator</type>
		<comment>
			<p>Emulators that are up to six months old or likely to receive further updates.</p>
		</comment>
		<emulators>
			&Daphne;
			&FinalBurnAlpha;
			&MAMEBeta;
			&MAMEChanges;
			&Nebula;
			&NebulaModel2;
			&RAINE;
			&Tickle;
			&WinKawaks;
		</emulators>
	</section>
	<section>
		<img src="OlderEmus.gif" width="140" height="40"/>
		<type>Emulator</type>
		<comment>
			<p>Emulators that are more than six months old.</p>
		</comment>
		<emulators>
			&OlderEmus;
		</emulators>
	</section>
	<section>
		<img src="Systems.gif" width="104" height="40"/>
		<type>System</type>
		<comment>
			<p>General systems used by multiple emulators.</p>
		</comment>
		<emulators>
			&CPS1;
			&CPS2;
			&NeoGeo;
			&ZN;
		</emulators>
	</section>
	<section>
		<img src="SoundEmus.gif" width="151" height="40"/>
		<type>Emulator</type>
		<comment>
			<p>Emulators that can play sound from the games but not the games themselves.</p>
		</comment>
		<emulators>
			&M1;
			&NebulaJukebox;
			&NeoJukeBox;
			&QPlayer;
		</emulators>
	</section>
	<section>
		<img src="ResourceFiles.gif" width="177" height="40"/>
		<type>Resource</type>
		<comment>
			<p>Additional resources that enhance the emulation of games.</p>
		</comment>
		<emulators>
			&MAMEArtwork;
			&MAMESamples;
		</emulators>
	</section>
</contents_page>
